{
  "$schema": "../../Schemas/scene-music-profile.schema.json",
  "schema": "moyva.scene-music-profile",
  "version": 1,
  "id": "globalmusicprofile",
  "model": "scene-music-profile",
  "targetScenes": [],
  "isGlobal": true,
  "defaultMusic": {
    "clip": {
      "$asset": "asset.audio-clip.tavern-music-loop.1155955e",
      "editorPath": "Assets/ThirdParty/Audio/NaPH - RPG & Fantasy Sounds Bundle/Bonus Music/Tavern Music Loop.wav",
      "required": true
    },
    "mixerGroup": {
      "$asset": "asset.audio-mixer-group-controller.music.35a28e1f",
      "editorPath": "Assets/Moyva/Audio/MoyvaMixer.mixer",
      "required": true
    },
    "volume": 0.7,
    "loop": true,
    "startDelay": 0.0,
    "fadeInDuration": 1.5,
    "fadeOutDuration": 1.5,
    "useCrossfade": true
  },
  "epicMusic": {
    "clip": {
      "$asset": "asset.audio-clip.epic-combat-music-loop.05c2e7af",
      "editorPath": "Assets/ThirdParty/Audio/NaPH - RPG & Fantasy Sounds Bundle/Bonus Music/Epic Combat Music Loop.wav",
      "required": true
    },
    "mixerGroup": {
      "$asset": "asset.audio-mixer-group-controller.music.35a28e1f",
      "editorPath": "Assets/Moyva/Audio/MoyvaMixer.mixer",
      "required": true
    },
    "volume": 0.7,
    "loop": true,
    "startDelay": 0.0,
    "fadeInDuration": 1.5,
    "fadeOutDuration": 1.5,
    "useCrossfade": true
  },
  "preserveMusicBetweenScenes": true,
  "sceneTransitionDuration": 2.0,
  "migration": {
    "sourceAssetGuid": "b4b6ba523a1ba1e8da7ce4eddbade8e8",
    "sourceAssetPath": "Assets/Moyva/Resources/MusicProfiles/GlobalMusicProfile.asset",
    "sourceHash": "e0a3e88fe0d970cf3264bd1383dceb5ec61404df6e43bf98d5b1232e3a0985c5"
  }
}